{
  "$schema": "./schemas/reference-images.schema.json",
  "schema_version": "invatrace.catalogue.reference-images.v1",
  "catalogue_version": "2.2.0",
  "source": "Wikimedia Commons",
  "source_terms": "https://commons.wikimedia.org/wiki/Commons:Reusing_content_outside_Wikimedia",
  "record_count": 32,
  "records": [
    {
      "species_id": "acacia-auriculiformis",
      "scientific_name": "Acacia auriculiformis",
      "verified_taxon_name": "Acacia auriculiformis",
      "wikidata_taxon_id": "Q2673522",
      "verification": "commons_exact_taxon_title",
      "local_url": "/reference-images/acacia_auriculiformis.jpg",
      "sha256": "fac4948750f034a5940d41c7375ef1fc92d7bed222e7b4f69daaa04a208e975d",
      "byte_length": 797063,
      "source_title": "File:Starr 031013-0030 Acacia auriculiformis.jpg",
      "source_url_or_identifier": "https://commons.wikimedia.org/wiki/File:Starr_031013-0030_Acacia_auriculiformis.jpg",
      "creator": "Forest & Kim Starr",
      "licence": "CC BY 3.0",
      "licence_url": "https://creativecommons.org/licenses/by/3.0",
      "retrieved_at": "2026-09-13",
      "reviewed_at": "2026-09-13",
      "attribution_text": "Forest & Kim Starr — File:Starr 031013-0030 Acacia auriculiformis.jpg — CC BY 3.0 — via Wikimedia Commons; resized for offline use."
    },
    {
      "species_id": "acacia-mangium",
      "scientific_name": "Acacia mangium",
      "verified_taxon_name": "Acacia mangium",
      "wikidata_taxon_id": "Q2673511",
      "verification": "wikidata_p18",
      "local_url": "/reference-images/acacia_mangium.jpg",
      "sha256": "bbbf51b6d173d0d87af22392a195ea33ee52f10dfbb52f474fe132e6ab3123d6",
      "byte_length": 1956283,
      "source_title": "File:Acácia Mangium - Sítio Caramonã.jpg",
      "source_url_or_identifier": "https://commons.wikimedia.org/wiki/File:Ac%C3%A1cia_Mangium_-_S%C3%ADtio_Caramon%C3%A3.jpg",
      "creator": "Rodrigo Padula",
      "licence": "CC BY-SA 4.0",
      "licence_url": "https://creativecommons.org/licenses/by-sa/4.0",
      "retrieved_at": "2026-09-13",
      "reviewed_at": "2026-09-13",
      "attribution_text": "Rodrigo Padula — File:Acácia Mangium - Sítio Caramonã.jpg — CC BY-SA 4.0 — via Wikimedia Commons; resized for offline use."
    },
    {
      "species_id": "arachis-pintoi",
      "scientific_name": "Arachis pintoi",
      "verified_taxon_name": "Arachis pintoi",
      "wikidata_taxon_id": "Q4783543",
      "verification": "wikidata_p18",
      "local_url": "/reference-images/arachis_pintoi.jpg",
      "sha256": "0711ef04894f01be2f4f0e6065dbd5b20f1907fead0c7a007c64afffdf9915e0",
      "byte_length": 377162,
      "source_title": "File:Arachis pintoi foliage and flower.jpg",
      "source_url_or_identifier": "https://commons.wikimedia.org/wiki/File:Arachis_pintoi_foliage_and_flower.jpg",
      "creator": "Ethel Aardvark",
      "licence": "CC BY 3.0",
      "licence_url": "https://creativecommons.org/licenses/by/3.0",
      "retrieved_at": "2026-09-13",
      "reviewed_at": "2026-09-13",
      "attribution_text": "Ethel Aardvark — File:Arachis pintoi foliage and flower.jpg — CC BY 3.0 — via Wikimedia Commons; resized for offline use."
    },
    {
      "species_id": "asclepias-curassavica",
      "scientific_name": "Asclepias curassavica",
      "verified_taxon_name": "Asclepias curassavica",
      "wikidata_taxon_id": "Q939991",
      "verification": "wikidata_p18",
      "local_url": "/reference-images/asclepias_curassavica.jpg",
      "sha256": "0965b304b23b19cfe326a6a412e3c2fe977bcf108aeb7e88c6280d5ab6beb6eb",
      "byte_length": 555584,
      "source_title": "File:Starr 071024-0085 Asclepias curassavica.jpg",
      "source_url_or_identifier": "https://commons.wikimedia.org/wiki/File:Starr_071024-0085_Asclepias_curassavica.jpg",
      "creator": "Forest & Kim Starr",
      "licence": "CC BY 3.0",
      "licence_url": "https://creativecommons.org/licenses/by/3.0",
      "retrieved_at": "2026-09-13",
      "reviewed_at": "2026-09-13",
      "attribution_text": "Forest & Kim Starr — File:Starr 071024-0085 Asclepias curassavica.jpg — CC BY 3.0 — via Wikimedia Commons; resized for offline use."
    },
    {
      "species_id": "bidens-pilosa",
      "scientific_name": "Bidens pilosa",
      "verified_taxon_name": "Bidens pilosa",
      "wikidata_taxon_id": "Q814421",
      "verification": "wikidata_p18",
      "local_url": "/reference-images/bidens_pilosa.jpg",
      "sha256": "d1fb6aca9143d1f6cf40a05c0e1d315363fde0ef24f34078004154bc08b15eac",
      "byte_length": 1069193,
      "source_title": "File:Bidens pilosa at Elmina West in Seksyen U15, Shah Alam 20231126 101332.jpg",
      "source_url_or_identifier": "https://commons.wikimedia.org/wiki/File:Bidens_pilosa_at_Elmina_West_in_Seksyen_U15,_Shah_Alam_20231126_101332.jpg",
      "creator": "Wiki Farazi",
      "licence": "CC0",
      "licence_url": "http://creativecommons.org/publicdomain/zero/1.0/deed.en",
      "retrieved_at": "2026-09-13",
      "reviewed_at": "2026-09-13",
      "attribution_text": "Wiki Farazi — File:Bidens pilosa at Elmina West in Seksyen U15, Shah Alam 20231126 101332.jpg — CC0 — via Wikimedia Commons; resized for offline use."
    },
    {
      "species_id": "calopogonium-mucunoides",
      "scientific_name": "Calopogonium mucunoides",
      "verified_taxon_name": "Calopogonium mucunoides",
      "wikidata_taxon_id": "Q9674680",
      "verification": "wikidata_p18",
      "local_url": "/reference-images/calopogonium_mucunoides.jpg",
      "sha256": "64a1e0fdec5cb83038aa57e2d9b75010bd68402b21fa995950a16fc225a2d8a2",
      "byte_length": 245630,
      "source_title": "File:Calopogonium mucunoides Desv. (7970228306).jpg",
      "source_url_or_identifier": "https://commons.wikimedia.org/wiki/File:Calopogonium_mucunoides_Desv._(7970228306).jpg",
      "creator": "Alex Popovkin, Bahia, Brazil from Brazil",
      "licence": "CC BY 2.0",
      "licence_url": "https://creativecommons.org/licenses/by/2.0",
      "retrieved_at": "2026-09-13",
      "reviewed_at": "2026-09-13",
      "attribution_text": "Alex Popovkin, Bahia, Brazil from Brazil — File:Calopogonium mucunoides Desv. (7970228306).jpg — CC BY 2.0 — via Wikimedia Commons; resized for offline use."
    },
    {
      "species_id": "cecropia-peltata",
      "scientific_name": "Cecropia peltata",
      "verified_taxon_name": "Cecropia peltata",
      "wikidata_taxon_id": "Q2998776",
      "verification": "wikidata_p18",
      "local_url": "/reference-images/cecropia_peltata.jpg",
      "sha256": "82fcca8a79626da7d66ce7cbbaa411eb2b5a1ffc4bc4e03c3327013e9f3e33da",
      "byte_length": 75785,
      "source_title": "File:Cecropia peltata-cluster.jpg",
      "source_url_or_identifier": "https://commons.wikimedia.org/wiki/File:Cecropia_peltata-cluster.jpg",
      "creator": "Jim Conrad",
      "licence": "Public domain",
      "licence_url": "https://commons.wikimedia.org/wiki/Commons:Copyright_tags",
      "retrieved_at": "2026-09-13",
      "reviewed_at": "2026-09-13",
      "attribution_text": "Jim Conrad — File:Cecropia peltata-cluster.jpg — Public domain — via Wikimedia Commons; resized for offline use."
    },
    {
      "species_id": "chromolaena-odorata",
      "scientific_name": "Chromolaena odorata",
      "verified_taxon_name": "Chromolaena odorata",
      "wikidata_taxon_id": "Q2583146",
      "verification": "wikidata_p18",
      "local_url": "/reference-images/chromolaena_odorata.jpg",
      "sha256": "764e3e6ddaa9421195f0ec689c68e9bc35aa75eda68c6f7b3916f9a3b6a38972",
      "byte_length": 193927,
      "source_title": "File:Chromolaena odorata by Ashasathees.jpg",
      "source_url_or_identifier": "https://commons.wikimedia.org/wiki/File:Chromolaena_odorata_by_Ashasathees.jpg",
      "creator": "Ashasathees",
      "licence": "Public domain",
      "licence_url": "https://commons.wikimedia.org/wiki/Commons:Copyright_tags",
      "retrieved_at": "2026-09-13",
      "reviewed_at": "2026-09-13",
      "attribution_text": "Ashasathees — File:Chromolaena odorata by Ashasathees.jpg — Public domain — via Wikimedia Commons; resized for offline use."
    },
    {
      "species_id": "cleome-rutidosperma",
      "scientific_name": "Cleome rutidosperma",
      "verified_taxon_name": "Cleome rutidosperma",
      "wikidata_taxon_id": "Q2978919",
      "verification": "wikidata_p18",
      "local_url": "/reference-images/cleome_rutidosperma.jpg",
      "sha256": "f84c8202ccc2af670e7acc6eae6a3f7fe3a77b9027a18798eab728ca001fe9fc",
      "byte_length": 679935,
      "source_title": "File:Arya.maman lelaki.cleome.lengkongwetan.2019.2.jpg",
      "source_url_or_identifier": "https://commons.wikimedia.org/wiki/File:Arya.maman_lelaki.cleome.lengkongwetan.2019.2.jpg",
      "creator": "Aris riyanto",
      "licence": "CC BY-SA 4.0",
      "licence_url": "https://creativecommons.org/licenses/by-sa/4.0",
      "retrieved_at": "2026-09-13",
      "reviewed_at": "2026-09-13",
      "attribution_text": "Aris riyanto — File:Arya.maman lelaki.cleome.lengkongwetan.2019.2.jpg — CC BY-SA 4.0 — via Wikimedia Commons; resized for offline use."
    },
    {
      "species_id": "cynodon-dactylon",
      "scientific_name": "Cynodon dactylon",
      "verified_taxon_name": "Cynodon dactylon",
      "wikidata_taxon_id": "Q208705",
      "verification": "wikidata_p18",
      "local_url": "/reference-images/cynodon_dactylon.jpg",
      "sha256": "73b325e6b3b23c2dcfaae027a4f42be2a74e8d8ba17482b8562b3620ca88de79",
      "byte_length": 670720,
      "source_title": "File:Cynodon dactylon sl4.jpg",
      "source_url_or_identifier": "https://commons.wikimedia.org/wiki/File:Cynodon_dactylon_sl4.jpg",
      "creator": "Stefan.lefnaer",
      "licence": "CC BY-SA 4.0",
      "licence_url": "https://creativecommons.org/licenses/by-sa/4.0",
      "retrieved_at": "2026-09-13",
      "reviewed_at": "2026-09-13",